{
  "$schema": "https://kubb.dev/schemas/kubb-extension.json",
  "kind": "parser",
  "name": "typescript",
  "export": "parserTs",
  "displayName": "TypeScript",
  "description": "Prints the Kubb AST as TypeScript source and rewrites the extensions of relative imports and exports.",
  "category": "typescript",
  "icon": {
    "light": "https://kubb.dev/feature/typescript.svg"
  },
  "tags": ["typescript", "tsx", "parser", "printer", "ast"],
  "docs": "https://kubb.dev/extensions/kubb-labs/parser-ts",
  "maintainers": [{ "name": "Stijn Van Hulle", "github": "stijnvanhulle" }],
  "compatibility": {
    "kubb": ">=5.8.3",
    "node": ">=22"
  }
}
