{
  "$schema": "https://kubb.dev/schemas/kubb-extension.json",
  "kind": "plugin",
  "name": "plugin-barrel",
  "export": "pluginBarrel",
  "displayName": "Barrel",
  "description": "Generates index.ts barrel files for every plugin output, plus a root barrel when output.barrel is set on defineConfig.",
  "category": "output",
  "icon": {
    "light": "https://kubb.dev/feature/plugins-light.svg"
  },
  "tags": ["barrel", "index", "exports", "output"],
  "docs": "https://kubb.dev/extensions/kubb-labs/plugin-barrel",
  "maintainers": [{ "name": "Stijn Van Hulle", "github": "stijnvanhulle" }],
  "compatibility": {
    "kubb": ">=5.8.3",
    "node": ">=22.12"
  }
}
